{"type":"config","name":"DeepSearchQA skill tuning for MiniMax M3 (you-web)","metricName":"deepsearchqa_avg","metricUnit":"","bestDirection":"higher"}
{"run":1,"commit":"82c924c","metric":0.830769,"metrics":{"deepsearchqa_pass_rate":0.8,"tool_calls_per_trial":13.2},"status":"keep","description":"baseline: current pre-sync skill on seed-42 shard (no code change)","timestamp":1788807566176,"segment":0,"confidence":null,"asi":{"headroom":"0.83 -> 1.0 = ~0.17 on shard; production full-900 = 0.7317","hypothesis":"baseline measurement of the current pre-sync skill (no code change) to anchor keep/discard","iter1_plan":"mechanical signature-sync: include_domains->site:cdc.gov (2x), drop offset, extraction_mode->extraction","noise_observed":"0.047 spread between two baseline runs on the same 15-trial shard (0.8778 manual vs 0.8308 loop) = M3 generation variance; keep/discard must beat this to be meaningful","shard":"5 tasks x k=3 = 15 trials, seed 42, 3 Single + 2 Set Answer","tool_surface_lever":"13.2 calls/trial already < production 28.6; over-calling lever is small on this shard, headroom is correctness not call-count"}}
{"run":2,"commit":"ad2af8b","metric":0.797436,"metrics":{"deepsearchqa_pass_rate":0.733333,"tool_calls_per_trial":12.93},"status":"keep","description":"iter 1: mechanical you-search signature sync (include_domains->site:, drop offset, extraction_mode->extraction). Within-noise drop; correctness baseline.","timestamp":1788807919368,"segment":0,"confidence":null,"asi":{"behavior_change_note":"the one real behavior change: site: operator now filters (include_domains was zod-stripped before, so site: was broken). This is the intended correctness fix. On the FAO task (#283, 'according to the FAO') the model may now narrow to site:fao.org — could help or over-narrow. Net effect on 5-task shard is small/noise.","hypothesis":"mechanical signature-sync: align skill param names to the current you-search surface (site: operator, drop offset, extraction enum). Behavior-neutral correctness baseline.","next_action_hint":"proceed to behavioral tuning: tool-call budget discipline + Set-Answer list discipline. If next 2 runs trend <0.80, investigate whether site: over-narrowing hurt the FAO task and soften the site: guidance.","noise_context":"drop 0.033 is within the 0.047 noise floor (2 baseline runs: 0.8778 manual, 0.8308 loop). sync is behavior-neutral by construction; keeping as the new correctness baseline per the approved iter-1 plan."}}
{"run":3,"commit":"5cb71f5","metric":0.830769,"metrics":{"deepsearchqa_pass_rate":0.8,"tool_calls_per_trial":12.13},"status":"checks_failed","description":"iter-2: tighter Phase 4 + tool budget — checks_failed on probe/ scratch env (fixed); metric equal-to-baseline on saturated shard","timestamp":1788808880852,"segment":0,"confidence":null,"asi":{"env_fix":"checks.sh now scopes tsc to .auto/tsconfig.checks.json (tracked src only); probe/ scratch excluded. Future runs won't stall on it.","failure_diagnosis":"shard is near-saturated: 4/5 tasks at 1.0. Leaks are stochastic: (a) deepsearchqa-115 trial2 = 3/3 correct but 7 EXCESSIVE authors -> F1 0.462 (answer-discipline leak); (b) deepsearchqa-762 trial0 = 0/1 correct, excluded France on bad urban-pop reasoning (search/correctness miss). The answer-discipline change targets (a) but the shard can't distinguish it from baseline (noise).","hypothesis":"iter-2: tighten Phase 4 answer discipline (exact set, no extras) + concrete tool budget (stop-when-found, 8-call ceiling).","next_action":"SWITCH eval shard to moderate-difficulty [0.3,0.7] tasks (239 available) for real headroom; re-baseline; re-apply answer-discipline there where Set-Answer excessive leaks are measurable. Holdout (50 tasks, 28 Set) remains the generalization truth-check.","rollback_reason":"checks failed on untracked probe/ scratch (tsc scanned gitignored files); env now fixed. Metric 0.8308 was equal-to-baseline on a near-saturated 5-task shard (4/5 at 1.0) = noise, not signal."}}
{"type":"config","name":"DeepSearchQA skill tuning for MiniMax M3 (hard headroom shard)","metricName":"deepsearchqa_avg","metricUnit":"","bestDirection":"higher"}
{"run":4,"commit":"023d052","metric":0.769586,"metrics":{"deepsearchqa_pass_rate":0.666667,"tool_calls_per_trial":13.47},"status":"keep","description":"baseline (v2): synced skill on hard headroom shard — 5 tasks, 2 Single + 3 Set","timestamp":1788809584939,"segment":1,"confidence":null,"asi":{"baseline_shard":"hard shard v2 (seed 7): 5 tasks, 2 Single + 3 Set, prod 0.33-0.56","failure_breakdown":"5/15 failures: 3 excessive-answer leaks (476 idx0/idx1 added Princeton +2; 525 idx1 added 7 extra countries, 5/5 correct but F1 0.588), 2 timeouts/failures (446 idx2 timed_out, 476 idx2 failed). 2 Single tasks (12, 804) saturated at 1.0.","hypothesis":"baseline of synced skill on hard shard — no code change","key_lever":"excessive answers on Set Answer (3/5 failures) + tool-call timeouts (2/15). Answer-discipline (no extras) + tool-budget (stop-when-found, fewer calls) directly target both."}}
{"run":5,"commit":"a7700ae","metric":0.890085,"metrics":{"deepsearchqa_pass_rate":0.8,"tool_calls_per_trial":18},"status":"keep","description":"iter1-v2: Phase 4 answer discipline (no extras) + concrete tool budget — +15.7% F1 (excessive leaks killed)","timestamp":1788810079353,"segment":1,"confidence":null,"asi":{"delta":"+0.1205 (+15.7%) vs baseline 0.7696 — well above 0.047 noise floor","hypothesis":"Phase 4 answer discipline (exact set, no extras, no padding) + concrete tool budget. Targets the 3 excessive-answer leaks + 2 timeouts observed in baseline.","mechanism_note":"F1 win is from answer discipline (reduced excessive answers). Tool budget '8 calls' was IGNORED — calls went UP 13.5->18. The model searches more to get the right set, which helped F1 but raised cost. Next: either enforce the budget harder or accept the higher calls if F1 keeps winning.","next_action":"Inspect per-task to confirm win = reduced excessive answers (not a fluke). Then either tighten Set-Answer list format or reduce the timeout failures (2/15 in baseline). Watch tool_calls as a cost signal.","secondary_note":"tool_calls_per_trial 13.47->18.0 (+34%) is a cost regression but F1 is the primary; secondary rarely decides. The 8-call ceiling wording is not being followed by M3."}}
{"run":6,"commit":"a7700ae","metric":0.833293,"metrics":{"deepsearchqa_pass_rate":0.666667,"tool_calls_per_trial":13.87},"status":"discard","description":"iter2-v2: Output Format filtered-answer-list — regressed -6% vs best (over-corrected recall or noise)","timestamp":1788810720324,"segment":1,"confidence":2.12176010705733,"asi":{"delta":"-0.057 vs best 0.8901 (iter1-v2); +0.064 vs baseline 0.77. Within ~1.2x noise floor — borderline.","hypothesis":"Output Format: force ## Answer to be a clean filtered list (only items matching criteria), relegate non-matching to ## Evidence. Target the 525 idx2 excessive leak (16 extra countries).","next_action":"Discard (regression). Re-run iter1-v2 state to confirm the 0.89 best is stable (2nd data point), then target a DIFFERENT lever: either 525 excessive via a more surgical fix, or 476 over-searching (42-46 calls, misses Harvard). Output Format filtering over-corrected or was noise.","rollback_reason":"worse than current best (0.8901->0.8333); Output Format change added verbosity without a clear F1 win. Simpler is better — revert."}}
{"run":7,"commit":"a7700ae","metric":0.81914,"metrics":{"deepsearchqa_pass_rate":0.733333,"tool_calls_per_trial":16.8},"status":"discard","description":"iter3-v2: Phase 4 filter-candidates bullet — regressed -8% (active filtering hurts recall; 2/2 filter attempts failed)","timestamp":1788812619782,"segment":1,"confidence":3.7829123958120805,"asi":{"delta":"-0.071 vs best 0.8901 (iter1-v2); +0.05 vs baseline. ~1.5x noise.","hypothesis":"Phase 4 bullet 4: 'filter candidates to only matching items; ## Answer is the filtered set'. Target 525 idx2 excessive (16 extra).","learning":"ACTIVE filtering instructions hurt (2/2 attempts regressed: Output Format -0.057, Phase4 bullet -0.071). The model over-filters and drops CORRECT items (recall loss) > the precision gain. iter1-v2's simple 'no extra items' PROHIBITION is the right level — do not add active filtering.","next_action":"Revert to iter1-v2 (best). Re-run iter1-v2 to get a 2nd data point — if ~0.89 the filtering changes are real regressions and iter1-v2 is the stable best; if ~0.83 the 0.89 was noise and reconsider. Then target 476 over-searching (42-46 calls, misses Harvard) via a convergence rule, NOT filtering.","rollback_reason":"worse than best; active-filtering hurts recall (2/2 filter attempts regressed). Revert to the 'no extras' prohibition level."}}
{"run":8,"commit":"5bbcdef","metric":0.937037,"metrics":{"deepsearchqa_pass_rate":0.866667,"tool_calls_per_trial":17.47},"status":"keep","description":"confirm: iter1-v2 re-run = 0.9370 (2nd data point; mean ~0.91 vs baseline 0.77). Improvement solidly real.","timestamp":1788813078177,"segment":1,"confidence":2.948496267079867,"asi":{"iter1_v2_runs":"0.8901, 0.9370 (mean ~0.91) — both well above baseline 0.77. 0.89 was not a fluke; +0.12-0.17 improvement is real.","noise_floor_confirmed":"2-run spread 0.047; iter1-v2 mean ~0.91 vs baseline 0.77 = +0.14 (3.8x+ noise).","note":"no code change — confirmation run of the committed iter1-v2 skill. M3 generation variance landed higher this run (0.937 vs 0.890).","validated_best":"iter1-v2 (Phase 4 'no extras' prohibition + concrete tool budget) is the stable best. Active filtering HURTS (2/2 attempts regressed). Next lever: 476 over-searching/convergence (42-46 calls, misses Harvard) — NOT filtering."}}
{"run":9,"commit":"5bbcdef","metric":0.78877,"metrics":{"deepsearchqa_pass_rate":0.733333,"tool_calls_per_trial":16.8},"status":"discard","description":"iter4-v2: set-enumeration convergence rule — regressed -12% (per-member search is necessary; forcing 1-search loses recall)","timestamp":1788817880885,"segment":1,"confidence":3.5598711693612737,"asi":{"delta":"-0.12 vs best mean 0.91; ~baseline. ~2.5x noise (likely real regression).","hypothesis":"Phase 2 bullet 6: set-enumeration efficiency (1 set search + 1 read, not per-member). Target the 476 42-call over-search + 11% holdout timeouts.","learning":"Convergence/efficiency rules HURT, like filtering. Set-enumeration tasks (476: 8 Ivy League unis) REQUIRE per-member searches — the authoritative page doesn't have all members in one place. Forcing '1 set search + 1 read' loses recall. 3 efficiency/filtering attempts all regressed. The model's verbose per-member enumeration is NECESSARY; the timeout tail (11%) is its structural cost, not fixable via skill text without recall loss.","next_action":"Discard. Try structurally-different lever: prevent 0-score TIMEOUTS via partial-answer-on-exhaustion (doesn't filter or reduce calls). Shard can't measure timeout benefit (no timeouts there) but can detect premature-give-up harm. Validate timeout benefit on a faster holdout if shard holds.","rollback_reason":"worse than best; forcing set-enumeration efficiency loses recall. 3rd efficiency/filtering attempt to regress."}}
{"run":10,"commit":"5bbcdef","metric":0.802405,"metrics":{"deepsearchqa_pass_rate":0.733333,"tool_calls_per_trial":10.27},"status":"discard","description":"iter5-v2: partial-answer + realistic tool budget — regressed -11% (calls and F1 coupled: 10 calls -> 0.80 vs 17 calls -> 0.91)","timestamp":1788818721403,"segment":1,"confidence":5.513697728021072,"asi":{"calls_vs_f1":"COUPLED. iter5: 10.27 calls -> 0.80 F1. iter1-v2: 17 calls -> 0.91 F1. Fewer calls = lower F1 (less thorough). The model needs ~17 calls for set-enumeration tasks; reducing them loses recall.","delta":"-0.11 vs best mean 0.91; tool_calls 17->10.27 (-41%).","hypothesis":"Revise Tool Budget: remove unrealistic '8 ceiling', add 'per-member is fine, stop when checked' + 'partial > nothing, never time out'. Target 11% holdout timeout tail.","key_insight":"iter1-v2's '8 ceiling' was a LUCKILY-IGNORED ceiling (model did 17 calls = thorough = 0.91). The new wording made the model FOLLOW the budget (10 calls) -> less thorough -> 0.80. So the timeout tail is structural cost of necessary enumeration; NOT fixable by reducing calls (costs F1) or filtering (costs recall). Only adapter-timeout increase (off-limits) or smarter search would help.","next_action":"Discard. iter1-v2 is CONVERGED: 4 attempts to beat it (2 filtering, 1 convergence, 1 fewer-calls) ALL regressed. Record iter1-v2 as the final tuned skill. Present to user with holdout validation (completed-trial 0.787 > production 0.7317; 11% timeout tail is a known structural limitation).","rollback_reason":"worse than best; reducing calls costs F1 (calls and F1 coupled). iter1-v2's ignored-ceiling (17 calls) is the sweet spot."}}
{"run":11,"commit":"6e6f8d6","metric":0.847619,"metrics":{"deepsearchqa_pass_rate":0.8,"tool_calls_per_trial":15.73},"status":"keep","description":"iter6: softer Phase 4 anti-padding (no over-search pressure) — shard +0.078, PROVISIONAL pending holdout validation","timestamp":1788822650290,"segment":1,"confidence":5.467073688334602,"asi":{"hypothesis":"Softer Phase 4 anti-padding: 'include only items the question asks for; keep supporting context in evidence not answer list'. iter1-v2 was right on DIRECTION (excessive answers leak precision) but too INTENSE ('exact set/no omissions/grader scores only requested set' caused over-search -> 5 holdout timeouts). This drops the over-search pressure, keeps the anti-pad nudge.","next_action":"MUST holdout-validate before considering settled. Run .auto/holdout.sh on this skill; compare to synced reference (all-trial 0.7306, completed-trial 0.7884, 3 timeouts, 20.21 calls). If holdout completed-trial > 0.7884 AND all-trial >= 0.7306 (no extra timeouts), it's a real generalizable win -> keep. If tied/worse, revert to synced (commit 328137c).","provisional":"SHARD WIN +0.078 but UNVALIDATED. iter1-v2 was +0.14 on shard yet TIED on holdout. Do NOT treat as final until holdout confirms.","shard_overfits":"proven by iter1-v2: +0.14 shard, 0.788 vs 0.788 holdout completed-trial (tied), worse all-trial (5 extra timeouts)."}}
{"run":12,"commit":"b16dc18","metric":0.7229,"metrics":{"deepsearchqa_pass_rate":0.6667,"tool_calls_per_trial":21.21},"status":"discard","description":"iter6 holdout validation: softer Phase 4 REJECTED — completed-trial 0.748 < synced 0.788 (5th anti-pad variant to fail); reverted to synced","timestamp":1788825166466,"segment":1,"confidence":5.513697728021072,"asi":{"decision":"REVERTED to synced (commit b16dc18). iter6 was committed provisionally (shard +0.078) but the holdout rejected it — this log records the holdout validation.","holdout_comparison":"iter6 softer-Phase4 on SAME 50 holdout tasks: completed-trial F1 0.7479 (145 completed, 0 timeouts) vs synced 0.7884 (139 completed, 3 timeouts). completed-trial -0.04 (worse), all-trial 0.7229 vs 0.7306 (worse), pass 66.7% vs 71.3% (worse). 0 timeouts is nice but each completed answer is WORSE — not a win.","hypothesis":"Softer Phase 4 anti-padding (drop the over-search pressure from iter1-v2, keep the 'don't pad' nuge). Tested whether iter1-v2 was right on direction but too intense.","learning":"5th anti-pad/filtering variant that fails to generalize (iter1-v2, iter2-v2 Output Format, iter3-v2 filter-candidates, iter6 softer). CONCLUSIVE: ANY skill-text instruction that tells the model to restrict/trim the answer list HURTS completed-trial recall on the real distribution. The model over-filters and drops correct items. The excessive-answer 'leak' visible on the 5-task shard is NOT fixable via skill text without recall loss. The grader's excessive-answer penalty is real but the cure (filtering) is worse than the disease.","next_action":"Skill-text answer-discipline is a DEAD END (5/5 failed to generalize). Stop pursuing Phase 4 / Output Format / filtering variants. The remaining generalizable levers are NOT skill-text: (1) raise adapter timeout (off-limits src/) to kill the timeout tail, (2) a larger eval shard so the loop's metric is trustworthy. Recommend stopping the skill-tuning loop — the synced skill (signature sync) is the honest best, and further shard iterations will keep overfitting.","rollback_reason":"holdout rejected: completed-trial F1 0.748 < synced 0.788 (real regression, above noise). Softer anti-pad still costs recall."}}
{"run":13,"commit":"592a875","metric":0.876614,"metrics":{"deepsearchqa_pass_rate":0.866667,"tool_calls_per_trial":14.8},"status":"keep","description":"iter7: Phase 4 answer-faithfulness (no hedge, no contradict) — shard +0.107, PROVISIONAL pending holdout (3rd shard-win, both prior rejected)","timestamp":1788825638763,"segment":1,"confidence":3.8124630025955093,"asi":{"diagnosis_source":"Diagnosed from PRODUCTION graded.jsonl (898 tasks) to keep holdout clean as validation set — zero-correct completed failures are heterogeneous: counting errors, hedging ('most likely'), contradicting own evidence (865: computed Luton, stated Stansted), wrong-entity. Confirmed general, not holdout-specific.","hypothesis":"Phase 4 answer-FAITHFULNESS (not filtering): 'state the exact value your authoritative source gives; don't hedge (most likely) or state a different value'. Targets hedging + self-contradiction subtypes of the 21 zero-correct holdout failures. NOT a filter/trim rule (no recall loss like 5 prior failures). NOT a re-verify step (no extra calls -> no timeout risk). Calls stayed 14.8 (no increase) confirming no over-search.","provisional":"3rd shard WIN (+0.107, pass 0.867, calls 14.8 no increase). Both prior shard-wins (iter1-v2 +0.14, iter6 +0.078) were HOLDOUT-REJECTED. MUST holdout-validate before settling.","validation_plan":"Run .auto/holdout.sh. Reference: synced all-trial 0.7306, completed-trial 0.7884, 3 timeouts, 20.21 calls. KEEP only if holdout completed-trial > 0.7884 AND all-trial >= 0.7306 (no extra timeouts). Else revert to synced (b16dc18)."}}
{"run":14,"commit":"574d1dc","metric":0.7236,"metrics":{"deepsearchqa_pass_rate":0.7,"tool_calls_per_trial":22.07},"status":"discard","description":"iter7 holdout validation: answer-faithfulness REJECTED (completed-trial 0.7753 vs synced 0.7884, tied within noise) — 3rd shard-win to fail generalization; reverted","timestamp":1788828091305,"segment":1,"confidence":3.3791621261653964,"asi":{"definitive_methodology_finding":"3/3 shard-wins (iter1-v2 +0.14, iter6 +0.078, iter7 +0.107) FAILED to generalize to the holdout. The 5-task shard is conclusively untrustworthy for skill tuning — its wins are overfit/noise. iter1-v2/iter6: filtering hurt recall. iter7: faithfulness TIED (0.7753 vs 0.7884, within noise), not an improvement.","holdout_comparison":"iter7 faithfulness on 50 holdout: completed-trial 0.7753 (140 comp, 0 timeouts, 10 failed) vs synced 0.7884 (139 comp, 3 timeouts, 8 failed). completed-trial -0.013 (WITHIN 0.047 noise = tied). all-trial 0.7236 vs 0.7306 (slightly worse). pass 70.0% vs 71.3%. 0 timeouts is nice but no F1 gain — the discipline neither helped nor clearly hurt the real distribution; the shard +0.107 was overfit/noise.","hypothesis":"Phase 4 answer-faithfulness (no hedge, no contradict own evidence). Diagnosed from PRODUCTION data (kept holdout clean). Targets the 21 zero-correct holdout failures (hedging + self-contradiction subtypes). Non-filtering, no call increase (14.8 on shard, 22.07 on holdout).","next_action":"STOP skill-text tuning on the 5-task shard. The methodology is exhausted: every shard-win overfits (3/3). The honest best is the synced skill (signature sync). Generalizable improvement requires non-skill-text levers: (1) raise adapter timeout (off-limits src/) for the timeout tail, (2) scale eval shard to >=30-50 tasks so the loop's metric is trustworthy. Recommend stopping the loop — further 5-task iteration is overfitting by definition.","rollback_reason":"holdout tied/rejected: completed-trial 0.7753 < synced 0.7884 (within noise, not a real gain). 3rd shard-win to fail generalization. Revert to synced (574d1dc)."}}
{"type":"config","name":"DeepSearchQA skill tuning for MiniMax M3 (30-task headroom shard)","metricName":"deepsearchqa_avg","metricUnit":"","bestDirection":"higher"}
{"run":15,"commit":"c0f52f6","metric":0,"metrics":{},"status":"crash","description":"30-task baseline — TIMEOUT at 900s (65/90 done); set-enum tail exceeds per-iter budget","timestamp":1788829030323,"segment":2,"confidence":null,"asi":{"hypothesis":"Methodology fix: scale eval shard 5->30 tasks so the loop's metric is trustworthy (3/3 prior 5-task shard-wins failed to generalize). 90 data points = 6x signal.","next_action":"The 30-task shard doesn't fit in 900s due to set-enum tail. Options: (a) raise run_experiment timeout to 1500s for 30-task runs, (b) reduce shard to ~20 tasks (~10-12 min, safer margin). (a) keeps more signal; try 1500s timeout on the 30-task shard. If still timing out, fall back to 20.","rollback_reason":"30-task x k=3 = 90 trials doesn't fit in 900s (long set-enum tail). The 30s/trial estimate was too optimistic for hard tasks. Runtime, not a correctness problem.","wall_time_observed":"65/90 trials in 900s => ~13.8s/trial effective (with concurrency 6). Tail tasks take much longer. Need ~1250s for 90 trials."}}
