{"run":16,"commit":"6fffe74","metric":0.708705,"metrics":{"deepsearchqa_pass_rate":0.616667,"tool_calls_per_trial":21.4},"status":"keep","description":"baseline (v3): synced skill on 20-task headroom shard (60 trials) — 0.7087. Trustworthy metric established.","timestamp":1788832483905,"segment":2,"confidence":null,"asi":{"baseline":"20-task shard (60 trials), synced skill. All 60 completed (0 timeouts at adapter level). Graded manually after the run_experiment tool timed out at 1500s just as gen finished.","hypothesis":"baseline of synced skill on the new 20-task headroom shard — establishes a trustworthy metric (60 data points, 4x the old 15) to make real skill improvements measurable.","noise_floor_note":"With 60 data points the M3 noise floor should be tighter than the 0.047 seen at 15 points. A real improvement must clear this to be kept.","per_iter_time":"Gen ~1400s + grade ~60s = ~24 min/iter (set-enum tail). Needs run_experiment timeout_seconds=1500+ and the last tail task may still occasionally push it. Production completed-trial holdout was 0.788; this harder shard at 0.709 is sensible.","trustworthy_metric":"60 points on moderate tasks (mean prod 0.55). 3/3 prior 5-task shard-wins failed holdout; this shard should not overfit as easily."}}
{"run":17,"commit":"6fffe74","metric":0.657203,"metrics":{"deepsearchqa_pass_rate":0.6,"tool_calls_per_trial":21.87},"status":"discard","description":"iter8 (trustworthy re-test): answer-faithfulness HURTS on 60-point shard — -5% (0.657 vs 0.709) + 2 timeouts. 5-task +0.107 was overfit/noise, confirmed.","timestamp":1788834308563,"segment":2,"confidence":null,"asi":{"delta":"-0.051 vs baseline 0.7087 on the 20-task shard (60 points). 2 timeouts (baseline had 0) — the 'don't hedge' pressure makes the model search longer to be certain.","hypothesis":"RE-TEST answer-faithfulness (iter7) on a TRUSTWORTHY 60-point shard. iter7 was +0.107 on the 5-task shard but holdout-tied (0.7753 vs 0.7884, within noise). This is the honest re-test: same hypothesis, metric that can distinguish real from noise.","learning":"CONFIRMED: the +0.107 on the 5-task shard was overfit/noise. On 60 points the faithfulness rule HURTS (-0.051) and adds timeouts. The 'don't hedge / don't contradict' pressure makes the model search longer (21.87 vs 21.40 calls) to be certain -> 2 timeouts. This is the 4th distinct skill-text hypothesis confirmed to not help the real distribution (filtering, anti-pad, convergence, faithfulness).","next_action":"Discard. The synced skill is the honest best (0.7087 on 60 points). Skill-text tuning is exhausted: every Phase4 variant either costs recall (filtering/anti-pad) or costs time (faithfulness -> timeouts) or overfits. Record the trustworthy-shard re-test as the definitive null result. The remaining lever is the off-limits adapter timeout (kills the timeout tail).","rollback_reason":"worse than baseline on a trustworthy 60-point metric (-0.051) + added timeouts. The 5-task +0.107 was overfit/noise, now confirmed.","trustworthy_metric_confirmed":"60-point shard distinguishes real from noise: faithfulness -0.051 is a real regression, not noise (vs the 5-task shard which gave +0.107 = noise)."}}
{"run":18,"commit":"c680e7b","metric":0.755889,"metrics":{"deepsearchqa_pass_rate":0.683333,"tool_calls_per_trial":22.07},"status":"keep","description":"iter9: Phase 2 read-before-re-searching (anti-redundancy) — FIRST trustworthy win +0.047 (0.756 vs 0.709), calls flat, 0 timeouts. PROVISIONAL pending re-run + holdout.","timestamp":1788835633746,"segment":2,"confidence":16.020027975584945,"asi":{"delta":"+0.0472 (+6.7%) over baseline 0.7087 on the 60-point shard. First win to clear the noise floor on a TRUSTWORTHY metric (vs the 3 overfit 5-task wins).","hypothesis":"Phase 2 'read before re-searching' — a structurally DIFFERENT lever (investigation, not answer). Targets redundant same-facet re-searches observed in at-risk multi-hop tasks (319: 5x 'bea.gov GDP' variants; 143: 6x 'OECD pension' variants). Anti-redundancy, NOT anti-calls or anti-extras: read 1-2 top URLs before re-searching the same facet.","mechanism_sound":"Calls flat (21.40 -> 22.07, within noise), 0 timeouts (baseline 0), all 60 completed. This is NOT the over-search (iter1-v2: 17 calls), filtering (iter6: recall loss), or faithfulness (iter8: +timeouts) failure modes. It's the first Phase 2 change.","next_action":"RE-RUN to confirm the +0.047 is stable (not a +1-sigma fluke). iter1-v2 lesson: confirm-then-holdout. If re-run holds ~0.74+, run .auto/holdout.sh for the generalization truth-check vs synced (0.7306 all-trial, 0.7884 completed-trial, 3 timeouts)."}}
{"run":19,"commit":"c680e7b","metric":0.725359,"metrics":{"deepsearchqa_pass_rate":0.65,"tool_calls_per_trial":23.77},"status":"discard","description":"iter9 confirm (re-run): 0.7254 — two runs mean 0.741 vs baseline 0.709, within ~0.030 noise. iter9 is within-noise, NOT a confirmed win.","timestamp":1788837016741,"segment":2,"confidence":32.04005595116989,"asi":{"confirm_run":"0.7254 (2nd run of iter9 skill). Two runs: 0.7559, 0.7254. Mean 0.7407 vs baseline 0.7087 = +0.032.","hypothesis":"RE-RUN (no code change) to confirm iter9's +0.047 first run is stable.","learning":"NOISE FLOOR on 60 points is ~0.030 (run-to-run spread 0.7559->0.7254 = 0.030). iter9 first run +0.047 = ~1.5x noise (borderline); mean of 2 runs +0.032 = ~1x noise (within). This is the iter1-v2 pattern repeating: first run looks like a win, second regresses to baseline. On a trustworthy metric, read-before-re-searching is WITHIN NOISE of baseline, NOT a confirmed generalizable improvement.","next_action":"Do NOT holdout-validate a within-noise shard result (chasing noise). Decision: iter9 is borderline — mean above baseline but within noise. The mechanism is the soundest tried (no recall loss, no timeout risk, Phase 2 not Phase 4) but the effect is too small to confirm on 60 points. Options: (a) accept iter9 as a marginal/non-harmful change (calls up slightly, F1 neutral-to-slightly-up), (b) revert to synced as the clean honest best. Lean (b) per 'don't overfit' — a within-noise change adds verbosity without a confirmed win. Revert; record Phase 2 read-before-re-search as 'within noise, not confirmed'.","noise_floor_revised":"~0.030 on 60 points (was estimated 0.047 at 15 points — tighter, as expected)"}}
{"run":20,"commit":"ed3e206","metric":0.70004,"metrics":{"deepsearchqa_pass_rate":0.6,"tool_calls_per_trial":21.77},"status":"discard","description":"iter10: Phase 1 criteria-locking — within-noise neutral (-0.009 vs 0.709); no benefit. 7th skill-text hypothesis exhausted across all 4 phases.","timestamp":1788838409052,"segment":2,"confidence":45.387834754413504,"asi":{"delta":"-0.009 vs baseline 0.7087 (within ~0.030 noise = neutral). calls flat (21.77 vs 21.40), 0 timeouts, no harm but no benefit.","hypothesis":"Phase 1 criteria-locking: 'state the exact criteria/filters the answer must satisfy; check each candidate against these before answering'. Targets the dominant zero-correct cluster (wrong-entity-among-candidates: 781 JetBlue vs Lynx, 81 FS vs UF, 143 France vs Italy, 319 added NY). Planning (pre-search) so no recall loss, no added calls.","learning":"7th skill-text hypothesis, 2nd within-noise on the trustworthy 60-pt metric (after iter9). The wrong-entity failures are a reasoning/selection issue at answer time that the model doesn't reliably execute from a planning instruction. Skill-text planning changes don't move the trustworthy metric either. ALL FOUR phases now tested: Phase 1 (criteria, within-noise), Phase 2 (read-before-re-search, within-noise), Phase 4 (filtering/anti-pad/faithfulness, fail), budget (fail).","next_action":"Discard (within-noise, no benefit). Skill-text tuning is now exhaustively tested across all 4 phases on a trustworthy metric — all within-noise or worse. The loop has converged: further skill-text iterations are noise-chasing. The only real remaining lever is the off-limits adapter timeout (kills the 0-score timeout tail). State this honestly; do not manufacture more noise-chasing hypotheses.","rollback_reason":"within-noise neutral (-0.009 << 0.030); no confirmed benefit, adds planning verbosity."}}
{"run":21,"commit":"86e42b1","metric":0.766336,"metrics":{"deepsearchqa_pass_rate":0.666667,"tool_calls_per_trial":21.97},"status":"keep","description":"iter11: contents-batching 3-5/call — +0.058 (0.766 vs 0.709), calls FLAT, 0 timeouts, faster wall. PROVISIONAL pending re-run confirm.","timestamp":1788839695265,"segment":2,"confidence":27.443141327508084,"asi":{"corroborating_signal":"Wall time 1150s vs ~1300-1400s for prior 60-trial runs — faster, consistent with fewer contents round-trips from batching.","delta":"+0.0576 (+8.1%) over baseline 0.7087 on 60-pt shard. ~1.9x the ~0.030 noise floor — promising but NOT confirmed.","hypothesis":"Phase 2 contents-batching: 3-5 URLs/call (was 1-3). Cuts call COUNT (less timeout risk) WITHOUT cutting COVERAGE (same pages read) — the one path the 'calls coupled to F1' lesson doesn't forbid, since it preserves read coverage. Grounded: model already batches 1-5 but mostly 1-2 (130/157 calls); at-risk tasks 89 contents calls reading 158 urls -> ~39 at 4/call (saves 50).","mechanism_sound":"Calls FLAT (21.97 vs 21.40, within noise — NOT the over-search that hurt iter9 +calls). 0 timeouts (baseline 0). pass_rate +5%. This is the first win where calls didn't rise — the batching targets round-trips not thoroughness.","next_action":"RE-RUN to confirm (iter1-v2/iter9 lesson: first-run wins regress). If re-run holds >baseline+0.030 (above noise), holdout-validate vs synced (0.7306 all-trial, 0.7884 completed-trial, 3 timeouts). If re-run regresses to within-noise, discard like iter9."}}
{"run":22,"commit":"107b5c1","metric":0.764675,"metrics":{"deepsearchqa_pass_rate":0.616667,"tool_calls_per_trial":23.5},"status":"keep","description":"iter11 confirm (re-run): 0.7647 — two runs mean 0.7655, spread 0.0016 (stable). +0.057 vs synced, distributions don't overlap. Holdout-validation next.","timestamp":1788840936219,"segment":2,"confidence":25.101080904028777,"asi":{"baseline_reference":"Synced on 20-task shard: 0.7087 (run 1) + iter10 within-noise 0.7000 (run 2, ~synced-equiv) => synced mean ~0.704. iter11 mean 0.7655 is +0.061 above, and the two distributions DON'T OVERLAP (lowest iter11 0.7647 > highest synced 0.7087).","confirm_run":"0.7647 (2nd run). Two runs: 0.7663, 0.7647. Spread 0.0016 (vs iter9's 0.030 that signaled noise). Mean 0.7655 vs baseline 0.7087 = +0.057 (+8%). STABLE — not a first-run fluke.","hypothesis":"RE-RUN (no code change) to confirm iter11 +0.058 is stable, not a first-run fluke like iter9.","mechanism_advantage_over_iter9":"iter9 was discarded for +calls (21.4->23.8, over-search) and 0.030 spread (noise). iter11 has calls FLAT (21.97), faster wall, and 0.0016 spread — sounder and stable. But iter1-v2 was +0.14 and STILL failed holdout, so shard stability alone doesn't prove generalization.","next_action":"MUST HOLDOUT-VALIDATE before settling (iter1-v2 lesson: even +0.14 shard wins fail holdout). Run .auto/holdout.sh on iter11. Reference synced holdout: all-trial 0.7306, completed-trial 0.7884, 3 timeouts, 20.21 calls. KEEP only if iter11 holdout completed-trial > 0.7884 AND all-trial >= 0.7306. Else revert."}}
{"run":23,"commit":"322c0b4","metric":0.7238,"metrics":{"deepsearchqa_pass_rate":0.6933,"tool_calls_per_trial":20.05},"status":"discard","description":"iter11 holdout validation: TIED (completed 0.798 vs synced 0.788, within noise) — 4th shard-win to fail generalization; reverted","timestamp":1788844530899,"segment":2,"confidence":27.443141327508084,"asi":{"holdout_comparison":"iter11 contents-batching on 50 holdout tasks: completed-trial 0.7983 (136 comp, 4 timeouts, 10 failed) vs synced 0.7884 (139 comp, 3 timeouts, 8 failed). completed +0.010 (WITHIN noise). all-trial 0.7238 vs 0.7306 = -0.007 (WITHIN noise). calls flat 20.05 vs 20.21 (good). TIED, not a real improvement.","hypothesis":"HOLDOUT validation of iter11 (contents-batching 3-5/call) — the truth-check after 2 stable +0.057 shard runs.","key_finding":"4TH shard-win to fail generalization (iter1-v2 +0.14, iter6 +0.078, iter7 +0.107, iter11 +0.057). iter11 is the FIRST with a sound mechanism (calls flat, faster wall, no recall loss) AND stable 2-run confirmation (spread 0.0016) — yet STILL tied on holdout. The 20-task HARD shard (prod 0.3-0.7) overfits too: batching helps hard multi-hop set-enum tasks (which dominate the hard shard) but is neutral on the broad distribution where single-facet tasks don't benefit. HARD-SUBSET SELECTION is the overfitting vector, not shard size or mechanism quality.","next_action":"Reverted to synced. Profound methodological conclusion: optimizing on ANY hard subset (5-task or 20-task) overfits to that subset's task mix. To get a generalizable skill improvement, the loop's metric must reflect the BROAD distribution (easy+hard mix), e.g. a 30-50 task RANDOM sample (not difficulty-filtered), or optimize directly on the holdout. The one real non-skill lever remains the off-limits adapter timeout.","rollback_reason":"holdout TIED (completed +0.010, all-trial -0.007, both within ~0.03 noise); no real improvement on the broad distribution."}}
{"type":"config","name":"DeepSearchQA skill tuning for MiniMax M3 (30-task random representative shard)","metricName":"deepsearchqa_avg","metricUnit":"","bestDirection":"higher"}
{"run":24,"commit":"06ce7d2","metric":0.793307,"metrics":{"deepsearchqa_pass_rate":0.7,"tool_calls_per_trial":19.5},"status":"keep","description":"baseline (v4): synced skill on 20-task RANDOM representative shard (60 trials) — 0.7933. Generalization-capable metric established.","timestamp":1788848075916,"segment":3,"confidence":null,"asi":{"baseline_random_shard":"20-task RANDOM representative shard (prod 0.0-1.0, median 0.889, mean 0.757 — broad distribution, NOT difficulty-filtered). This is the methodology fix demanded by the iter11 finding (hard-subset shards overfit 4/4).","hypothesis":"baseline of synced skill on the new random representative shard — establishes a generalizable-signal metric.","note":"Score 0.7933 is higher than the 20-task HARD shard baseline (0.7087) because this random shard includes easier tasks (median prod 0.889 vs 0.55) — representative of the real distribution. This is the trustworthy generalization-capable baseline."}}
{"run":25,"commit":"06ce7d2","metric":0.714804,"metrics":{"deepsearchqa_pass_rate":0.633333,"tool_calls_per_trial":18.53},"status":"discard","description":"iter12: contents-batching on random shard — REGRESSED -0.079 (calls coupled to F1 catches read-batching too). Methodology validated: random shard correctly shows regression where hard shard falsely showed +0.057.","timestamp":1788849914512,"segment":3,"confidence":null,"asi":{"delta":"-0.0785 (-9.9%) vs random-shard baseline 0.7933 — a real REGRESSION on the generalization-capable metric. Calls dropped 19.50->18.53 (batching reduced calls).","hypothesis":"RE-TEST iter11 contents-batching on the RANDOM representative shard (generalization-capable metric). iter11 was +0.057 on the hard shard but TIED on holdout; the random shard (matching the broad distribution) is the decisive test.","key_finding":"METHODOLOGY VALIDATED: the random representative shard correctly shows contents-batching as a REGRESSION (-0.079), where the hard shard falsely showed +0.057. The hard-shard win was overfit to set-enum tasks; on the broad distribution (single-facet tasks needing focused 1-URL reads), batching more URLs/call means less thorough per-facet reading -> lower F1. This is the 'calls coupled to F1' trap catching even read-batching: fewer calls = lower F1 (same pattern as iter5: 10 calls->0.80, 17->0.91). The random shard is a trustworthy predictor (matches holdout), the hard shard is not.","next_action":"Discard. This confirms the synced skill (0.7933) is the best AND validates the random-shard methodology. The skill-text lever is exhausted: ALL changes that reduce or redistribute calls cost F1 on the broad distribution. Final answer = synced skill (signature sync).","rollback_reason":"real regression on the generalization-capable random shard (-0.079, well above 0.030 noise). Batching reduces calls -> costs F1."}}
{"run":26,"commit":"06ce7d2","metric":0.770506,"metrics":{"deepsearchqa_pass_rate":0.7,"tool_calls_per_trial":14.87},"status":"discard","description":"iter13: commit-don't-refuse on random shard — F1 neutral (-0.023, within noise) but calls -24%. Confirms calls-coupled-to-F1 invariant (13th hypothesis).","timestamp":1788852271401,"segment":3,"confidence":null,"asi":{"calls_drop":"19.50 -> 14.87 (-24%) — the FIRST hypothesis to reduce calls without an explicit budget instruction. The 'commit don't refuse' framing made the model stop earlier and answer.","delta":"-0.023 vs random-shard baseline 0.7933 (within ~0.030 noise = neutral). pass_rate flat 0.70. 2 timeouts (baseline 1).","hypothesis":"Phase 4 commit-don't-refuse: 'commit the best-supported candidate(s) you found to the answer; do not say you cannot determine it.' Diagnosed from BROAD-distribution (random shard) failures: deepsearchqa-241 3/3 trials found US+Netherlands but said 'I cannot provide a definitive answer' — refusal-to-commit, not wrong-answer. Distinct from iter7 (faithfulness added certainty pressure -> over-search); this targets commitment, not certainty.","learning":"Confirms calls-coupled-to-F1 again: the commit framing cut calls 24% (the model stopped searching and committed), and F1 went slightly down (within noise). Fewer calls = slightly lower F1, the invariant holds. This is the FIRST hypothesis to reduce calls without an explicit budget instruction — interesting cost lever but not an F1 win. 13th hypothesis; primary metric (F1) neutral-to-slightly-negative.","next_action":"Discard (F1 neutral, not a win; primary metric decides). The calls-coupled-to-F1 invariant is now rock-solid: ANY change that reduces calls (budget, convergence, batching, commit-framing) costs F1 on the broad distribution. The only F1 lever is MORE/better search, which hits the timeout wall (off-limits adapter). Skill-text tuning is conclusively exhausted on the random representative shard too.","rollback_reason":"F1 neutral-to-slightly-negative (-0.023, within noise); primary metric not improved. Calls dropped (cost win) but F1 is primary."}}
{"run":27,"commit":"06ce7d2","metric":0.775337,"metrics":{"deepsearchqa_pass_rate":0.733333,"tool_calls_per_trial":18.83},"status":"discard","description":"iter14: explanatory anti-refusal — F1 neutral (-0.018), pass_rate +3.3%, calls -3.4%. Anti-refusal concept exhausted (2/2 framings neutral-negative); structural call-F1 tradeoff.","timestamp":1788853793661,"segment":3,"confidence":null,"asi":{"calls":"18.83 vs baseline 19.50 (-3.4%) — LESS call-drop than iter13's -24%, confirming the explanatory framing had less stop-early pressure. But calls still dropped -> F1 still coupled.","delta":"-0.018 vs baseline 0.7933 (within ~0.030 noise = neutral). pass_rate +3.3% (0.70->0.733) — the anti-refusal IS converting some 0-score refusals to partial credit.","hypothesis":"EXPLANATORY anti-refusal (vs iter13 imperative): 'a refused/blank answer scores 0; a wrong committed answer also scores 0; a partially-correct committed answer scores >0; refusing never helps.' Model reasons about it rather than told to stop. Targets the 241 refusal case (3/3 found US+Netherlands but refused).","learning":"Anti-refusal concept tested TWICE now (iter13 imperative -24% calls/-0.023, iter14 explanatory -3.4% calls/-0.018). The concept is STRUCTURALLY exhausted, not a framing issue: anti-refusal inherently means committing earlier (stop searching), and calls-coupled-to-F1 means the broad distribution loses more from the call reduction than it gains from the refusal fixes. pass_rate up +3.3% proves the refusal fix works mechanistically, but F1 is neutral-to-negative because the call reduction costs F1 elsewhere. 14th hypothesis.","next_action":"Discard (F1 neutral, primary decides). Anti-refusal is the 14th hypothesis; concept exhausted (2 framings, both neutral-negative). The calls-coupled-to-F1 invariant now has 6 confirmations. Skill-text tuning is conclusively exhausted: every lever reduces calls (F1 drop), adds calls (timeout), or is within noise. The ONLY F1 lever is the off-limits adapter timeout.","rollback_reason":"F1 neutral-to-slightly-negative (-0.018, within noise); primary metric not improved. pass_rate gain is a secondary signal; primary decides."}}
