{"run":28,"commit":"06ce7d2","metric":0.761409,"metrics":{"deepsearchqa_pass_rate":0.65,"tool_calls_per_trial":18.53},"status":"discard","description":"iter15: Phase 3 synthesis check — F1 -0.032 (at noise, negative), calls -5%. 7th calls-coupled-to-F1 confirmation; 'use what you have' implies stop-searching. 5 phases exhausted.","timestamp":1788855641340,"segment":3,"confidence":null,"asi":{"calls":"18.53 (-5%) — 'do not search again' reduced calls again. The 'use what you have' framing implies 'stop searching'.","delta":"-0.032 vs baseline 0.7933 (at noise floor, slightly negative). pass_rate DOWN -5% (0.70->0.65) — opposite of iter14; the commit pressure converted to incomplete answers not partial credit here.","hypothesis":"Phase 3 SYNTHESIS check (not re-search): 'scan the evidence you ALREADY gathered for the answer to each part; if evidence contains a value that satisfies a criterion, USE IT; do not search again; the most common failure is gathering the answer in a read and not committing it.' Grounded: 5/7 zero-correct baseline trials had gold tokens in their READ evidence but didn't commit them (241: 3/3, 802: 4/4).","learning":"7TH confirmation of calls-coupled-to-F1. Even framed as 'use already-gathered evidence' (not 'commit early'), the 'do not search again' wording reduces calls (-5%) -> F1 drop. ANY instruction that says 'use what you have' implies 'stop searching' -> calls drop -> F1 drops. The gather-but-don't-commit leak IS real (5/7 had gold in evidence) but the cure (commit/use) structurally trades calls for commitment, and calls-coupled-to-F1 makes that net-neutral-to-negative. 15th hypothesis across all 5 phases (1,2,3,4,budget).","next_action":"Discard (F1 -0.032, at noise floor, negative). The invariant is now absolute: every skill-text lever reduces calls (F1 drop), adds calls/certainty (timeout), or is within noise. ALL 5 phases tested. The gather-but-don't-commit leak needs a NON-skill-text fix: either a 'final synthesis' harness step (off-limits src/), or the model reading its own trajectory before answering (a capability issue, not a skill-text issue).","rollback_reason":"F1 at/slightly-below noise floor negative (-0.032); 'do not search again' reduced calls -> F1 coupled. pass_rate down."}}
{"run":29,"commit":"06ce7d2","metric":0.773072,"metrics":{"deepsearchqa_pass_rate":0.7,"tool_calls_per_trial":19.27},"status":"discard","description":"iter16: Phase 4 final self-checklist (deductive, calls flat) — F1 neutral (-0.020, within noise). Self-check can't add missing data; committed-wrong stems from gathering, not checking.","timestamp":1788857099812,"segment":3,"confidence":null,"asi":{"calls_flat":"19.27 vs 19.50 (within noise = FLAT). The 'do not search again for this check - use evidence you already gathered' wording KEPT calls flat, unlike iter15's -5%. First deductive-check framing that didn't reduce calls.","delta":"-0.020 vs baseline 0.7933 (within ~0.030 noise = neutral). pass_rate flat (0.70).","failure_subtypes_targeted":"14/18 baseline failures were committed-wrong (not refusals): omission (488 missed 2012, 802 missed 13 states) + over-inclusion (103 added 9 extras, 340 added 2). Self-checklist targets both: 'confirm every item satisfies ALL filters (drop non-matching); confirm you checked every candidate (add missed)'.","hypothesis":"Phase 4 FINAL SELF-CHECKLIST (deductive, not process): 'before finalizing, check your drafted answer against the question's exact criteria: for a list, confirm every item satisfies ALL stated filters (drop any that do not) and confirm you checked every candidate (add any missed). Do not search again for this check - use evidence you already gathered.' Targets 14/18 committed-wrong failures (omission + over-inclusion on Set Answer).","learning":"Self-checklist is the SOUNDEST deductive lever (no call drop, no timeout, no recall loss) — and STILL neutral (-0.020, within noise). Confirms the conclusion from a new angle: the committed-wrong errors aren't a CHECKING deficit. The model knows the criteria. It mis-enumerates because (a) underlying DATA GATHERING is incomplete (omission: 488/802 missed members that were never in evidence) or (b) it can't distinguish matching from non-matching without RE-READING (over-inclusion: 103/340). A deductive self-check can't ADD missing data or re-read — it operates on what's already drafted. 16th hypothesis, 5 phases exhausted + this deductive variant.","next_action":"Discard (F1 neutral, primary decides). The conclusion is now multi-angle: the committed-wrong failures stem from incomplete DATA GATHERING (omission) and need re-reading (over-inclusion), neither fixable by a deductive check on the drafted answer. The only fixes are MORE/better search (timeout wall, off-limits adapter) or a final-synthesis harness step (off-limits src/). Skill-text is conclusively exhausted on 3 independent framings (process/synthesis/deductive).","rollback_reason":"F1 neutral within noise (-0.020); no improvement. Self-checklist can't add missing data or re-read; the committed-wrong failures stem from data gathering, not checking."}}
{"run":30,"commit":"06ce7d2","metric":0.746458,"metrics":{"deepsearchqa_pass_rate":0.7,"tool_calls_per_trial":19.03},"status":"discard","description":"iter17: lean principle-based skill (89->42 lines) — REGRESSED -0.047 (real). Simplification hurts; the prescriptive 4-phase pipeline is load-bearing for M3.","timestamp":1788858440600,"segment":3,"confidence":null,"asi":{"delta":"-0.047 vs baseline 0.7933 — a REAL regression (above ~0.030 noise floor). pass_rate flat, calls flat (19.03).","hypothesis":"SIMPLIFICATION: replace the 89-line prescriptive 4-phase pipeline with a 42-line lean principle-based skill (keep signature-sync fixes + highest-signal rules: commit, exact-criteria, read-before-answer — but as principles not steps). Test whether the heavy scaffolding drives the mechanical over-search-then-refuse pattern, and a frontier model (M3) would reason better with less prescription.","learning":"SIMPLIFICATION HURTS. The prescriptive 4-phase pipeline scaffolding was HELPING M3, not driving the over-search. Removing it dropped F1 -0.047 (real regression) with calls FLAT — so the structure improves answer quality through guidance, not call-count. M3 benefits from explicit step-by-step prescription (Plan/Investigate/Verify/Answer), not principle-based reasoning. Refutes the 'over-instruction causes mechanical behavior' hypothesis for this model. 17th hypothesis.","next_action":"Discard (real regression). The conclusion is now even stronger: the synced skill's structure is load-bearing. ALL 17 hypotheses (add instructions across 5 phases, 3 framings, AND remove instructions via simplification) fail to improve the broad distribution. Skill-text tuning is exhausted in BOTH directions (add and remove). Revert to synced (the 89-line pipeline is the validated best).","rollback_reason":"real regression -0.047 (above noise); simplification hurts, the pipeline scaffolding is load-bearing for M3."}}
{"run":31,"commit":"06ce7d2","metric":0.722425,"metrics":{"deepsearchqa_pass_rate":0.65,"tool_calls_per_trial":16.37},"status":"discard","description":"iter18 (methodology): synced-skill re-run = 0.7224 vs 0.7933 baseline — random-shard noise floor is ~0.071, not 0.030. Reinterprets iter13-17 as noise, not regressions.","timestamp":1788859938044,"segment":3,"confidence":null,"asi":{"calls_variance":"16.37 vs 19.50 — even calls vary run-to-run (-16%)","delta":"-0.071 vs the 0.7933 baseline run on the SAME synced skill — the random-shard noise floor is ~0.071, NOT 0.030 as I'd estimated from the hard shard.","hypothesis":"METHODOLOGY CHECK: re-run the synced skill (no code change) on the random representative shard to establish the true noise floor. The 0.7933 baseline was a single run; iter13-17 were judged 'neutral-to-negative within ~0.030' against it.","key_finding":"THE RANDOM-SHARD NOISE FLOOR IS ~0.071, not 0.030. The 0.7933 baseline was a HIGH run; this re-run is 0.7224 (LOW). Implications: (1) iter13-17 deltas (-0.020 to -0.047) were ALL within the true 0.071 noise floor — none were statistically real regressions, they were noise. (2) iter11's +0.057 hard-shard win and iter9's +0.057 were ALSO within a comparable noise floor. (3) The 'calls coupled to F1' conclusion is WEAKENED — calls varied 16.37 to 19.50 to 23.5 across synced runs, and F1 varied 0.72 to 0.79. The correlation may be partly noise. (4) On a 60-point shard, 0.071 noise = +/-1.3 trials per direction = the M3 generation variance dominates.","next_action":"Reinterpret: skill-text deltas of <0.071 are NOISE, not signal. The synced skill (0.72-0.79 range, mean ~0.76) is the best we have, but no skill-text change showed a delta >0.071 on the random shard, so NONE are confirmed real. The honest conclusion: a 60-point shard cannot resolve skill-text effects <0.071. To get signal, need a MUCH larger eval (>=200 tasks) or many repeated runs. The session's skill-text hypotheses remain unconfirmed either way. State this honestly; do not claim 'neutral' changes are real regressions."}}
{"run":32,"commit":"06ce7d2","metric":0.724525,"metrics":{"deepsearchqa_pass_rate":0.616667,"tool_calls_per_trial":19.47},"status":"discard","description":"iter19 (methodology): 3rd baseline = 0.7245. Synced skill runs: 0.7933/0.7224/0.7245 (mean 0.747, range 0.071). 60-pt shard CANNOT resolve skill-text effects <0.07.","timestamp":1788861138903,"segment":3,"confidence":null,"asi":{"baseline_runs":"0.7933, 0.7224, 0.7245 (mean 0.747). The 0.7933 was a HIGH outlier; stable level ~0.72-0.75. Range 0.071.","hypothesis":"THIRD baseline run (no code change) to nail the noise floor: is 0.7224 the low or is 0.7933 the high outlier?","key_finding":"0.7245 ~= 0.7224 (run 2) — the stable level is ~0.72-0.75, and 0.7933 (run 1) was the HIGH outlier. The synced skill on the random shard is ~0.747 mean, ~0.071 range. DEFINITIVE: a 60-point shard CANNOT resolve skill-text effects <0.07. All iter13-17 deltas (|0.020| to |0.047|) are NOISE. The 'calls coupled to F1' conclusion across those iters is NOT supported at this noise level — calls varied 16.37/19.47/19.50 across synced runs with no consistent F1 correlation.","next_action":"Record the definitive methodology conclusion: the 60-point random shard has a ~0.071 noise floor, larger than every skill-text delta observed. To resolve skill-text effects, need >=200 tasks or 5+ repeated runs per condition (median). The session's hypotheses remain UNCONFIRMED either way (not 'failed' — just unresolvable at this sample size). The synced skill (~0.747) is the best we have; no change beat the noise floor. State honestly: skill-text tuning is unresolvable on this shard, not conclusively negative."}}
{"run":33,"commit":"8ddf254","metric":0.811219,"metrics":{"deepsearchqa_pass_rate":0.716667,"tool_calls_per_trial":19.87},"status":"discard","description":"iter20 (methodology): 4th baseline = 0.8112. Synced runs 0.79/0.72/0.72/0.81 (range 0.089). Definitive: 60-pt shard cannot resolve skill-text effects.","timestamp":1788862503926,"segment":3,"confidence":null,"asi":{"baseline_runs_now":"0.7933, 0.7224, 0.7245, 0.8112 (mean 0.763, median 0.758, range 0.089). The noise is ~0.09, even larger than the 3-run estimate.","hypothesis":"4th baseline run (no code change) to nail the synced-skill distribution on the random shard.","key_finding":"DEFINITIVE: the 60-point random shard has a ~0.09 noise floor (range 0.72-0.81 across 4 synced runs). This dwarfs EVERY skill-text delta observed in the session (max |0.057|). The loop's primary metric CANNOT resolve skill-text effects at this sample size — full stop. No single-run comparison is valid; 'keep/discard' on a 60-point shard is noise-chasing.","next_action":"Record the definitive conclusion. To resolve skill-text effects (<0.06) requires either: (1) >=200-300 tasks (k=3, ~2-3h/run), or (2) 5+ repeated runs per condition with median (5x23min=2h per condition), or (3) optimize on the holdout (50 tasks, but also noisy single-run). The 60-point loop is fundamentally underpowered for skill-text tuning. The synced skill (median 0.758) is the best estimate; no change was confirmed real. Honest stop: further 60-point iterations are noise-chasing."}}
{"run":34,"commit":"3ea4355","metric":0.769727,"metrics":{"deepsearchqa_pass_rate":0.688889,"tool_calls_per_trial":20},"status":"keep","description":"iter21 (methodology): k=9 stable baseline (180 trials) = 0.7697, agrees with k=3 mean 0.763. Noise floor now ~0.052. Decisive test of iter16 next.","timestamp":1788865978310,"segment":3,"confidence":null,"asi":{"baseline":"k=9 stable baseline (180 trials): 0.7697, pass 0.689, calls 20.0. 56 min wall.","hypothesis":"Raise k 3->9 in measure.sh to halve the noise floor (~0.09 -> ~0.052) so skill-text effects become resolvable. This is a methodology fix (more trials/task averages out M3 generation variance), not a skill change.","noise_floor_k9":"~0.052 estimated (0.09 * sqrt(3/9)). A skill-text effect must exceed this to be real.","validation_check":"k=9 baseline 0.7697 vs k=3 mean 0.763 — agree within 0.007, confirming k=9 is stable and the k=3 mean was a good estimate despite high single-run variance.","next_action":"Test the most promising hypothesis (iter16 self-checklist, calls-flat, was neutral within k=3 noise) at k=9. If it beats 0.7697 by >0.05 -> real win, holdout-validate. If within 0.05 -> confirmed noise, the lever is dead."}}
{"run":35,"commit":"3ea4355","metric":0.734435,"metrics":{"deepsearchqa_pass_rate":0.677778,"tool_calls_per_trial":19.94},"status":"discard","description":"iter22: iter16 self-checklist at k=9 — 0.7344 vs baseline 0.7697 (-0.035, within k=9 noise ~0.052). WITHIN-NOISE-OF-NEUTRAL. Lever is genuinely null at affordable resolution.","timestamp":1788869541391,"segment":3,"confidence":null,"asi":{"delta":"-0.035 vs k=9 baseline 0.7697. At k=9 noise floor ~0.052, this is WITHIN noise — not a confirmed regression, but also not a win.","hypothesis":"DECISIVE k=9 test of iter16 self-checklist (the calls-flat, deductive hypothesis). At k=9 the noise floor is ~0.052, so a real effect >0.052 would be visible; the k=3 -0.020 was unresolvable.","key_finding":"At k=9 (180 trials, noise ~0.052): iter16 self-checklist = 0.7344 vs baseline 0.7697 = -0.035, WITHIN the k=9 noise floor. Calls flat (19.94 vs 20.0), pass flat. So the lever is WITHIN-NOISE-OF-NEUTRAL — not helpful, not clearly harmful. The k=9 test gives a tighter verdict than k=3: the self-checklist doesn't improve broad-distribution F1, but the earlier 'it regresses' verdicts were noise. Tighter conclusion: this skill-text lever is genuinely null at the resolution we can afford.","next_action":"Discard (no improvement; within-noise neutral). The k=9 methodology WORKS — it resolved the k=3 ambiguity (was it -0.02 or noise? -> it's within-noise neutral, not a real effect). But k=9 is 56 min/run = too slow for a loop, and the lever is null anyway. Revert to synced. The honest conclusion stands: skill-text effects at the 0.03-0.05 level are null or unresolvable even at k=9; a real effect would need to exceed ~0.05 to show, and none did. The synced skill (0.770 at k=9) is the best.","rollback_reason":"no improvement (within-noise neutral at k=9); primary metric not improved. Lever is genuinely null at affordable resolution."}}
{"run":36,"commit":"20cea90","metric":0.771981,"metrics":{"deepsearchqa_pass_rate":0.716667,"tool_calls_per_trial":18.6},"status":"discard","description":"iter23: Output Format complete-enumeration cue at k=9 — +0.002 vs baseline (within noise). Neutral; omission stems from gathering, not output format. 19th hypothesis.","timestamp":1788872837492,"segment":3,"confidence":null,"asi":{"delta":"+0.0023 vs k=9 baseline 0.7697 — essentially ZERO (within k=9 noise ~0.052). Cleanest neutral yet.","hypothesis":"Output Format COMPLETE-ENUMERATION cue (structurally distinct from iter2-v2 filtering prose). Changed template: '[For a list/set, put every item that satisfies the criteria on its own line — do not stop at a partial set; if the question asks for all matching items, list them all.]' Targets the omission failures (334 1/2, 340 1/3, 103 1/6, 802 16/26 — model finds some members, drops rest). Output Format, not Phase 4 prose.","key_finding":"At k=9 (resolution that can resolve): Output Format complete-enumeration = 0.7720 vs 0.7697 = +0.0023, WITHIN noise. pass_rate +0.028 (0.689->0.717, maybe converted a few omissions to passes), calls -1.4. The cue is NEUTRAL — the omission failures aren't caused by the template missing an enumeration cue; the model drops members it didn't fully gather/verify, not because the output format told it to stop early. This is the LEAST-HARMFUL structural change (unlike iter2-v2 filtering which regressed). 19th hypothesis, first Output-Format-structural test at k=9.","next_action":"Discard (no improvement; +0.002 within noise). Confirms omission stems from data gathering, not output formatting — consistent with iter16's conclusion (committed-wrong stems from gathering, not checking/formatting). The synced skill (0.770) remains best. The session has now tested 19 hypotheses at k=9 resolution on the random shard; none exceeded the 0.052 noise floor. Skill-text tuning is null at affordable resolution.","rollback_reason":"no improvement (+0.002 within k=9 noise); primary metric flat. Omission stems from gathering, not output format."}}
{"run":37,"commit":"20cea90","metric":0.748751,"metrics":{"deepsearchqa_pass_rate":0.694444,"tool_calls_per_trial":17.2},"status":"discard","description":"iter24 (methodology): 2nd k=9 baseline = 0.7488. k=9 noise ~0.021 (tighter than est 0.052). Reinterprets iter22 as small-real-negative, iter23 as neutral. Synced median 0.759.","timestamp":1788877050157,"segment":3,"confidence":null,"asi":{"baseline_runs":"0.7697, 0.7488 (median 0.759, mean 0.759, spread 0.021). The k=9 noise floor is ~0.021, TIGHTER than the 0.052 estimate (the estimate used sqrt(3/9)=0.577 scaling from the 0.09 k=3 noise, but the real k=3 noise was inflated by trial-level outliers that k=9 averages out better than linear).","hypothesis":"2nd k=9 baseline (no code change) to verify the 0.7697 is stable and validate the k=9 noise floor estimate.","key_finding":"k=9 noise floor is ~0.021 (2-run spread), tighter than estimated 0.052. This RE-INTERPRETS iter22/23: iter22 self-checklist -0.035 is now slightly OUTSIDE the 0.021 noise (a small real negative, not noise). iter23 Output Format +0.002 is squarely NEUTRAL. The k=9 methodology is sound and tighter than expected; the synced skill median is 0.759. Both tested levers are confirmed null-or-negative (not helpful).","next_action":"The synced skill (k=9 median 0.759) is the best. k=9 (180 trials, ~70 min/run) is a sound, tight metric — tighter than the k=3 0.09 noise. The session has 2 k=9 baselines + 2 k=9 hypothesis tests; both levers null-or-negative. The honest conclusion stands: skill-text tuning is null at the resolution we can afford; no lever beat the synced skill."}}
{"run":38,"commit":"cea79ed","metric":0.767105,"metrics":{"deepsearchqa_pass_rate":0.7,"tool_calls_per_trial":18.18},"status":"discard","description":"iter25: full_page extraction (search+read combined) at k=9 — +0.008 vs median (within noise). Model adopted it (calls -9%) but F1 flat. 20th hypothesis, last tool-surface lever, NEUTRAL.","timestamp":1788881013821,"segment":3,"confidence":null,"asi":{"calls":"18.18 vs baseline 20.0 (-9%) — the model DID adopt full_page extraction, combining search+read and cutting calls. But F1 didn't move.","delta":"+0.008 vs k=9 baseline median 0.759 (runs 0.7697, 0.7488). Within the 0.021 k=9 noise floor — NEUTRAL.","hypothesis":"Teach `extraction: full_page` with `extraction_source: cache` (a real you-search feature the skill never mentioned) — combines search+read in one call, returning full page content in search results. Targets the timeout tail (fewer round-trips) WITHOUT recall loss (same content). Distinct from iter11 (batched reads only) and convergence (reduced searches at recall cost). The LAST untried tool-surface lever.","key_finding":"20th hypothesis, NEUTRAL at k=9 (+0.008 within 0.021 noise). The model adopted full_page (calls -9%) but F1 didn't improve. Confirms the session-wide conclusion from the final angle: the F1 ceiling is set by data-gathering QUALITY, not call efficiency. Even giving the model a tool feature that combines search+read (cuts calls, same content) doesn't help F1. The at-risk timeout tasks' problem isn't round-trip count — it's that the model needs many searches to find all the data, and full_page doesn't change what data exists. Every plausible skill-text lever (5 phases + Output Format + simplification + the new full_page tool feature) is now exhausted at k=9 resolution: all null-or-negative.","next_action":"Discard (neutral). CONCLUSIVE: 20 hypotheses at k=9 resolution (noise 0.021), all null-or-negative. No skill-text change improves broad-distribution F1. The synced skill (k=9 median 0.759; holdout 0.7306/0.7884) is the validated best. The only real F1 lever is the off-limits adapter timeout. Stop skill-text iteration — the lever is exhaustively null.","rollback_reason":"neutral within k=9 noise (+0.008); no improvement. The last tool-surface lever is null, confirming the conclusion."}}
